{
  "kind": "resolve",
  "rules": [
    "R-RES-001"
  ],
  "description": "Layer-pair L2-L3 for dimension contrast (FR-058).",
  "input": {
    "theme": {
      "opentheme": "1.0",
      "id": "uid.abcdefghijklmnopqrstuv2345",
      "version": "1.0.0",
      "name": "Harbor",
      "provenance": {
        "origin": "user-created"
      },
      "compatibility": {
        "catalog": "1.0"
      },
      "colorSchemes": {
        "supported": [
          "light",
          "dark"
        ],
        "default": "light"
      },
      "seeds": {
        "light": {
          "background": {
            "colorSpace": "srgb",
            "components": [
              0.98,
              0.97,
              0.95
            ]
          },
          "foreground": {
            "colorSpace": "srgb",
            "components": [
              0.12,
              0.12,
              0.14
            ]
          },
          "accent": {
            "colorSpace": "oklch",
            "components": [
              0.55,
              0.15,
              250
            ]
          }
        },
        "dark": {
          "background": {
            "colorSpace": "srgb",
            "components": [
              0.12,
              0.12,
              0.14
            ]
          },
          "foreground": {
            "colorSpace": "srgb",
            "components": [
              0.92,
              0.92,
              0.94
            ]
          },
          "accent": {
            "colorSpace": "oklch",
            "components": [
              0.7,
              0.12,
              250
            ]
          }
        },
        "fontFamily": [
          "system-ui",
          "sans-serif"
        ]
      },
      "customization": {
        "points": [
          {
            "id": "std.accent"
          },
          {
            "id": "std.color-scheme"
          },
          {
            "id": "std.contrast"
          },
          {
            "id": "std.text-size"
          },
          {
            "id": "std.density"
          },
          {
            "id": "std.corner-roundness"
          },
          {
            "id": "std.motion"
          }
        ]
      }
    },
    "selection": {
      "id": "uid.abcdefghijklmnopqrstuv2345"
    },
    "previous": null,
    "platform": {
      "colorScheme": "light",
      "contrast": "standard",
      "forcedColors": false,
      "reducedMotion": false,
      "textScale": 1
    },
    "environment": {
      "sizeClass": "expanded",
      "locale": "en",
      "direction": "ltr"
    },
    "preferences": {
      "std.contrast": "high"
    },
    "policy": {
      "availableThemes": [
        "uid.abcdefghijklmnopqrstuv2345",
        "org.opentheme.baseline"
      ],
      "defaultTheme": "org.opentheme.baseline",
      "permittedPoints": {
        "std.accent": {},
        "std.color-scheme": {},
        "std.contrast": {},
        "std.text-size": {},
        "std.density": {},
        "std.corner-roundness": {},
        "std.motion": {}
      }
    }
  },
  "expect": {
    "subset": true,
    "resolved": {
      "applied.fallback": "none",
      "context.contrast": "high"
    }
  }
}
