{
  "kind": "validate",
  "rules": [
    "R-LIM-006"
  ],
  "description": "Token path segment of 65 characters (OT-LIM-006).",
  "input": {
    "theme": {
      "generate": {
        "generator": "long-segment",
        "params": {
          "segmentLength": 65,
          "base": {
            "opentheme": "1.0",
            "id": "uid.abcdefghijklmnopqrstuv2345",
            "version": "1.0.0",
            "name": "Quiet Paper",
            "provenance": {
              "origin": "user-created"
            },
            "compatibility": {
              "catalog": "1.0"
            },
            "colorSchemes": {
              "supported": [
                "light"
              ],
              "default": "light"
            },
            "seeds": {
              "light": {
                "background": {
                  "colorSpace": "srgb",
                  "components": [
                    0.98,
                    0.97,
                    0.95
                  ]
                },
                "foreground": {
                  "colorSpace": "srgb",
                  "components": [
                    0.12,
                    0.12,
                    0.14
                  ]
                },
                "accent": {
                  "colorSpace": "oklch",
                  "components": [
                    0.55,
                    0.15,
                    250
                  ]
                }
              },
              "fontFamily": [
                "Inter",
                "system-ui",
                "sans-serif"
              ]
            }
          }
        }
      }
    }
  },
  "expect": {
    "validity": "invalid",
    "diagnostics": [
      {
        "code": "OT-LIM-006",
        "location": {
          "document": "theme",
          "pointer": "/tokens/abbbbbbbbbbbbbbbbbbbbbbbbbbbbbbbbbbbbbbbbbbbbbbbbbbbbbbbbbbbbbbbb"
        }
      }
    ]
  }
}
