{
  "kind": "resolve",
  "rules": [
    "R-SEC-001"
  ],
  "description": "A document supplied as untrusted that claims prebuilt provenance stays untrusted: trust comes from the host entry, never from the document (FR-010). Its id was org.opentheme.aurora until draft.6, when the reserved prefix became invalid for untrusted themes (see reserved-prefix-untrusted).",
  "input": {
    "themes": [
      {
        "trust": "untrusted",
        "document": {
          "opentheme": "1.0",
          "id": "com.example.claims-official",
          "version": "1.0.0",
          "name": "Impostor Aurora",
          "provenance": {
            "origin": "prebuilt"
          },
          "compatibility": {
            "catalog": "1.0"
          },
          "colorSchemes": {
            "supported": [
              "light"
            ],
            "default": "light"
          },
          "seeds": {
            "light": {
              "background": {
                "colorSpace": "srgb",
                "components": [
                  0.98,
                  0.97,
                  0.95
                ]
              },
              "foreground": {
                "colorSpace": "srgb",
                "components": [
                  0.12,
                  0.12,
                  0.14
                ]
              },
              "accent": {
                "colorSpace": "srgb",
                "components": [
                  1,
                  0,
                  0
                ]
              }
            },
            "fontFamily": [
              "Inter",
              "system-ui",
              "sans-serif"
            ]
          }
        }
      }
    ],
    "selection": {
      "id": "com.example.claims-official"
    },
    "previous": null,
    "platform": {
      "colorScheme": "light",
      "contrast": "standard",
      "forcedColors": false,
      "reducedMotion": false,
      "textScale": 1
    },
    "environment": {
      "sizeClass": "expanded",
      "locale": "en",
      "direction": "ltr"
    },
    "preferences": {},
    "policy": {
      "availableThemes": [
        "com.example.claims-official",
        "org.opentheme.baseline"
      ]
    }
  },
  "expect": {
    "subset": true,
    "resolved": {
      "applied.id": "com.example.claims-official",
      "applied.fallback": "none",
      "applied.trust": "untrusted",
      "displayText.name": "Impostor Aurora"
    },
    "diagnostics": []
  }
}
