{
  "kind": "validate",
  "rules": [
    "R-VER-005"
  ],
  "description": "Deprecated token emits OT-VER-005 with replacement.",
  "input": {
    "theme": {
      "opentheme": "1.0",
      "id": "uid.abcdefghijklmnopqrstuv2345",
      "version": "1.0.0",
      "name": "Quiet Paper",
      "provenance": {
        "origin": "user-created"
      },
      "compatibility": {
        "catalog": "1.0"
      },
      "colorSchemes": {
        "supported": [
          "light"
        ],
        "default": "light"
      },
      "seeds": {
        "light": {
          "background": {
            "colorSpace": "srgb",
            "components": [
              0.98,
              0.97,
              0.95
            ]
          },
          "foreground": {
            "colorSpace": "srgb",
            "components": [
              0.12,
              0.12,
              0.14
            ]
          },
          "accent": {
            "colorSpace": "oklch",
            "components": [
              0.55,
              0.15,
              250
            ]
          }
        },
        "fontFamily": [
          "system-ui",
          "sans-serif"
        ]
      },
      "tokens": {
        "color": {
          "legacy": {
            "$type": "color",
            "$deprecated": {
              "replacement": "color.surface.base",
              "note": "use surface"
            },
            "$value": {
              "colorSpace": "srgb",
              "components": [
                1,
                1,
                1
              ]
            }
          }
        }
      }
    }
  },
  "expect": {
    "validity": "valid",
    "diagnostics": [
      {
        "code": "OT-VER-005",
        "severity": "warning",
        "location": {
          "document": "theme",
          "pointer": "/tokens/color/legacy"
        },
        "rule": "R-VER-005"
      }
    ]
  }
}
