{
  "kind": "validate",
  "rules": [
    "R-REF-001",
    "R-REF-002"
  ],
  "description": "A theme token may alias a baseline token it does not redeclare: baseline tokens always exist through their specification defaults (FR-016, FR-017).",
  "input": {
    "theme": {
      "opentheme": "1.0",
      "id": "uid.k7q2m4x5c3v6b6n2z5r7t2y4wa",
      "version": "1.0.0",
      "name": "Quiet Paper",
      "provenance": {
        "origin": "user-created"
      },
      "compatibility": {
        "catalog": "1.0"
      },
      "colorSchemes": {
        "supported": [
          "light"
        ],
        "default": "light"
      },
      "seeds": {
        "light": {
          "background": {
            "colorSpace": "srgb",
            "components": [
              0.98,
              0.97,
              0.95
            ]
          },
          "foreground": {
            "colorSpace": "srgb",
            "components": [
              0.12,
              0.12,
              0.14
            ]
          },
          "accent": {
            "colorSpace": "oklch",
            "components": [
              0.55,
              0.15,
              250
            ]
          }
        },
        "fontFamily": [
          "Inter",
          "system-ui",
          "sans-serif"
        ]
      },
      "tokens": {
        "color": {
          "brand": {
            "$type": "color",
            "$value": "{color.surface.base}"
          }
        },
        "space": {
          "gutter": {
            "$type": "dimension",
            "$value": "{space.4}"
          }
        }
      }
    },
    "bases": [],
    "host": null
  },
  "expect": {
    "validity": "valid",
    "diagnostics": []
  }
}
